{
  "id": "fixture-key-door",
  "gate": 1,
  "name": "Fixture: key and door",
  "tiles": [
    "#######",
    "#.....#",
    "#.#####",
    "#....G#",
    "#######"
  ],
  "player": { "x": 1, "y": 1 },
  "blocks": [],
  "items": [{ "id": "key-gold", "kind": "key", "color": "gold", "at": { "x": 3, "y": 1 } }],
  "doors": [{ "id": "door-gold", "color": "gold", "at": { "x": 4, "y": 3 } }],
  "timers": { "standard": 60, "expert": 30 },
  "routes": { "safe": [], "standard": [], "expert": [] },
  "criticalPath": [],
  "seed": 0
}
