{
  "id": "fixture-blocks-safe",
  "gate": 3,
  "name": "Fixture: block out of the critical path",
  "tiles": [
    "#######",
    "#..#..#",
    "#..#..#",
    "#....G#",
    "#######"
  ],
  "player": { "x": 1, "y": 3 },
  "blocks": [{ "x": 1, "y": 1 }],
  "items": [],
  "doors": [],
  "timers": { "standard": 60, "expert": 30 },
  "routes": { "safe": [], "standard": [], "expert": [] },
  "criticalPath": [],
  "seed": 0
}
